{
  "schema": "migo-v8-component-manifest/v1",
  "component_id": "008961651cb075dafffe3c3e6c52deb178e83319a7601fb04c00326ccf01da15",
  "target": {
    "triple": "aarch64-linux-android",
    "os": "android",
    "arch": "aarch64",
    "abi": "android",
    "cpu_baseline": "armv8-a",
    "required_cpu_features": [
      "neon"
    ],
    "runtime_floor": {
      "android_api": "26"
    }
  },
  "toolchain": {
    "rustc": "rustc 1.89.0 (29483883e 2025-08-04) | binary: rustc | commit-hash: 29483883eed69d5fb4db01964cdf2af4d86e9cb2 | commit-date: 2025-08-04 | host: x86_64-unknown-linux-gnu | release: 1.89.0 | LLVM version: 20.1.7",
    "compiler": "Android (8481493, based on r416183c2) clang version 12.0.9 (https://android.googlesource.com/toolchain/llvm-project c935d99d7cf2016289302412d708641d52d2f7ee) | Target: aarch64-unknown-linux-android26 | Thread model: posix | InstalledDir: ${ANDROID_NDK_HOME}/toolchains/llvm/prebuilt/linux-x86_64/bin",
    "sdk": "Android NDK 23.2.8568313; API 26 sysroot; source.properties sha256=db78b6fa43a79ad75699e147ef90b6996e423f577ce5bd9cbdeff2ab98bdf798",
    "linker": "LLD 12.0.9 (/buildbot/src/android/llvm-r416183/out/llvm-project/lld c935d99d7cf2016289302412d708641d52d2f7ee) (compatible with GNU linkers)"
  },
  "runtime": {
    "backend": "v8",
    "rusty_v8_version": "145.0.0",
    "rusty_v8_revision": "e6a88b35dd3d7f2849a0df33a71d338701c55316",
    "v8_revision": "8defb67673c5483ae56258a2de01b07e947dc921",
    "normalized_gn_args": [
      "android_ndk_api_level=26",
      "android_ndk_root=${ANDROID_NDK_HOME}",
      "android_ndk_version=r23",
      "chrome_pgo_phase=0",
      "exclude_unwind_tables=true",
      "is_official_build=true",
      "symbol_level=0",
      "use_thin_lto=false",
      "v8_enable_i18n_support=true",
      "v8_enable_pointer_compression=true",
      "v8_enable_sandbox=false",
      "v8_enable_webassembly=true"
    ],
    "patches": [
      {
        "id": "0001-unset-bindgen-extra-clang-args",
        "sha256": "21a5e151cc831c8a9cda655d458fa7669f402ae1d3b96d29ade788ca20b45063"
      },
      {
        "id": "0002-use-sysroot-on-android",
        "sha256": "6d4d89570c9d48281101c51483ba262a797d221343a54d2adea05a4529816db1"
      },
      {
        "id": "0003-custom-libcxx-for-snapshot-toolchain",
        "sha256": "9c68fd6110b6a1b2549f731816defa1cf20cb204fe96d488c433dc7ec7e1f368"
      },
      {
        "id": "migo-prebuilt-binding",
        "sha256": "db9f843bb8a3d9b9c86c5ae87272a33efacd32a238a00f576d052a82a54b3389"
      }
    ]
  },
  "hashes": {
    "archive": "681aaa39367a9aa35ab7e584ddd4b36273acbc0ccb4177648c43b9b55b7eb273",
    "rust_binding": "47369bfb3ee9a7e6e0f451ae20242595d5a7f0b3afcc0b9447e4f99ff174686a"
  },
  "provenance": {
    "source_revision": "e6a88b35dd3d7f2849a0df33a71d338701c55316",
    "build_recipe": "scripts/build-v8-android.sh",
    "build_recipe_sha256": "71b2ed2439fa21798655ed383216d2dec30569c5df2d1e3e551edb6477ea8a84",
    "licenses": [
      "BSD-3-Clause",
      "MIT"
    ]
  }
}
