{
  "schema": "migo-v8-component-manifest/v1",
  "component_id": "1f45aad8099ef7646ec561cec4d39d2db6fc1fc0a6647318da0d01c15c9f83f6",
  "target": {
    "triple": "x86_64-unknown-linux-ohos",
    "os": "linux",
    "arch": "x86_64",
    "abi": "ohos",
    "cpu_baseline": "x86-64-v1",
    "required_cpu_features": [
      "cmov",
      "sse2"
    ],
    "runtime_floor": {
      "ohos_api": "18"
    }
  },
  "toolchain": {
    "rustc": "rustc 1.89.0 (29483883e 2025-08-04) | binary: rustc | commit-hash: 29483883eed69d5fb4db01964cdf2af4d86e9cb2 | commit-date: 2025-08-04 | host: x86_64-unknown-linux-gnu | release: 1.89.0 | LLVM version: 20.1.7",
    "compiler": "clang version 22.0.0git (https://chromium.googlesource.com/a/external/github.com/llvm/llvm-project bd1bd178f8e3770b296f9b042bef1d45bd736e51) | Target: x86_64-unknown-linux-ohos | Thread model: posix | InstalledDir: ${RUSTY_V8_SRC}/third_party/llvm-build/Release+Asserts/bin",
    "sdk": "OpenHarmony native SDK 5.1.0.107; API 18 sysroot; oh-uni-package.json sha256=16cac01a0f3829a89353e7117e823da2a5d4f3be1e6c3250024409f39f85f987",
    "linker": "LLD 22.0.0 (https://chromium.googlesource.com/a/external/github.com/llvm/llvm-project bd1bd178f8e3770b296f9b042bef1d45bd736e51) (compatible with GNU linkers)"
  },
  "runtime": {
    "backend": "v8",
    "rusty_v8_version": "145.0.0",
    "rusty_v8_revision": "e6a88b35dd3d7f2849a0df33a71d338701c55316",
    "v8_revision": "8defb67673c5483ae56258a2de01b07e947dc921",
    "normalized_gn_args": [
      "chrome_pgo_phase=0",
      "custom_toolchain=//build/toolchain/ohos:clang_x64",
      "exclude_unwind_tables=true",
      "host_toolchain=//build/toolchain/linux:clang_x64",
      "is_cfi=false",
      "ohos_clang_wrapper_dir=${OHOS_NDK_HOME}/.migo-v8-wrappers",
      "ohos_sdk_native=${OHOS_NDK_HOME}/native",
      "treat_warnings_as_errors=false",
      "use_allocator_shim=false",
      "use_glib=false",
      "use_partition_alloc_as_malloc=false",
      "use_thin_lto=false",
      "v8_enable_sandbox=false",
      "v8_monolithic=true",
      "v8_monolithic_for_shared_library=true",
      "v8_snapshot_toolchain=//build/toolchain/linux:clang_x64",
      "v8_use_external_startup_data=false"
    ],
    "patches": [
      {
        "id": "0001-unset-bindgen-extra-clang-args",
        "sha256": "21a5e151cc831c8a9cda655d458fa7669f402ae1d3b96d29ade788ca20b45063"
      },
      {
        "id": "0002-use-sysroot-on-android",
        "sha256": "6d4d89570c9d48281101c51483ba262a797d221343a54d2adea05a4529816db1"
      },
      {
        "id": "0003-custom-libcxx-for-snapshot-toolchain",
        "sha256": "9c68fd6110b6a1b2549f731816defa1cf20cb204fe96d488c433dc7ec7e1f368"
      },
      {
        "id": "0008-ohos-toolchain",
        "sha256": "db22ae84cd9d44e85189dffe68e37316ebda107c6e0ff6771bc482cd3de16549"
      },
      {
        "id": "migo-prebuilt-binding",
        "sha256": "db9f843bb8a3d9b9c86c5ae87272a33efacd32a238a00f576d052a82a54b3389"
      }
    ]
  },
  "hashes": {
    "archive": "b097549b3816254410ee7cc64b03935759e40e210d1ad8d3ed4e3761c85f89ad",
    "rust_binding": "47369bfb3ee9a7e6e0f451ae20242595d5a7f0b3afcc0b9447e4f99ff174686a"
  },
  "provenance": {
    "source_revision": "e6a88b35dd3d7f2849a0df33a71d338701c55316",
    "build_recipe": "scripts/build-v8-ohos.sh",
    "build_recipe_sha256": "834c4278c82cf21a92c77c305ab2213493e3e27daedb1f44281d6b55e1411d78",
    "licenses": [
      "BSD-3-Clause",
      "MIT"
    ]
  }
}
