{
  "schema": "migo-v8-component-manifest/v1",
  "component_id": "19f63547262b83d1bed2aba0edfd33f222bc784664e0cfb6238c3dfe570c9504",
  "target": {
    "triple": "aarch64-pc-windows-msvc",
    "os": "windows",
    "arch": "aarch64",
    "abi": "msvc",
    "cpu_baseline": "armv8-a",
    "required_cpu_features": [
      "neon"
    ],
    "runtime_floor": {
      "msvc_runtime": "MD (dynamic CRT)"
    }
  },
  "toolchain": {
    "rustc": "rustc 1.89.0 (29483883e 2025-08-04)\nbinary: rustc\ncommit-hash: 29483883eed69d5fb4db01964cdf2af4d86e9cb2\ncommit-date: 2025-08-04\nhost: x86_64-pc-windows-msvc\nrelease: 1.89.0\nLLVM version: 20.1.7",
    "compiler": "MSVC 14.44.35207 (cl.exe, arm64, cross from x64 host)",
    "sdk": "Windows SDK 10.0.26100.0",
    "linker": "MSVC link.exe 14.44.35207"
  },
  "runtime": {
    "backend": "v8",
    "rusty_v8_version": "145.0.0",
    "rusty_v8_revision": "0b8cfc5ae9d2507031076df2acdf61b0742a4c4e",
    "v8_revision": "8defb67673c5483ae56258a2de01b07e947dc921",
    "normalized_gn_args": [
      "use_allocator_shim=false",
      "use_partition_alloc_as_malloc=false",
      "v8_enable_i18n_support=true",
      "v8_enable_pointer_compression=true",
      "v8_enable_sandbox=false",
      "v8_enable_webassembly=true"
    ],
    "patches": []
  },
  "hashes": {
    "archive": "c61efee378e3a6b1a6934690e25f2cc5945918c2e088b44d95a92372055c4828",
    "rust_binding": "1b645c73eaa10989ade387fad9e47bcdecc910b1ce19867ff132991683c3c765"
  },
  "provenance": {
    "source_revision": "0b8cfc5ae9d2507031076df2acdf61b0742a4c4e",
    "build_recipe": "scripts/build-v8-windows.sh",
    "build_recipe_sha256": "749fdfb942b8749d1424193504469a648eec3d3f784b997ab9a3761ffc9b0c5c",
    "licenses": [
      "BSD-3-Clause",
      "MIT"
    ]
  }
}
